{
  "items": [
    {
      "coachingCues": [],
      "events": [
        "floor"
      ],
      "goals": [],
      "id": "arabesque-handstand-bridge-kickover",
      "instructions": [
        "Fall from arabesque to handstand.",
        "Use a bridge against a block before kicking over to lunge."
      ],
      "skills": [
        "arabesque",
        "handstand",
        "bridge kickover"
      ],
      "sourceRefs": [
        "crop_manifest: floor/floor_shapes_arabesque"
      ],
      "sourceStatus": "tested",
      "sourceType": "progression",
      "tags": [
        "arabesque",
        "handstand",
        "bridge",
        "floor"
      ],
      "title": "Arabesque to Handstand and Bridge Kickover",
      "variants": []
    },
    {
      "coachingCues": [],
      "events": [
        "beam"
      ],
      "goals": [],
      "id": "beam-pullover-progression",
      "instructions": [
        "Use a beam for the pullover.",
        "Begin with a spot, then progress to independent pullovers when the athlete is comfortable."
      ],
      "skills": [
        "pullover"
      ],
      "sourceRefs": [
        "implementation_ideas:46-49"
      ],
      "sourceStatus": "idea",
      "sourceType": "progression",
      "tags": [
        "beam",
        "pullover",
        "grip",
        "core"
      ],
      "title": "Beam Pullover: Spot to Independent",
      "variants": []
    },
    {
      "coachingCues": [
        "Look at the hands.",
        "Keep the belly and shoulders open."
      ],
      "events": [
        "floor"
      ],
      "goals": [
        "open shoulders",
        "handstand line",
        "backward rotation"
      ],
      "id": "bridge-backwalkover-cartwheel-progression",
      "instructions": [],
      "skills": [
        "bridge",
        "back walkover",
        "cartwheel",
        "front handspring step-out"
      ],
      "sourceRefs": [
        "crop_manifest: floor/bridge_backwalkover_cartwheel"
      ],
      "sourceStatus": "tested",
      "sourceType": "progression",
      "tags": [
        "bridge",
        "walkover",
        "backward",
        "floor"
      ],
      "title": "Bridge, Back Walkover, and Cartwheel Progression",
      "variants": [
        {
          "id": "bridge-backwalkover-cartwheel-progression:variant:0",
          "instructions": [
            "Use bridge work at a block, then finish with an arch rock."
          ],
          "sourceRefs": [
            "past: L4_lesson_04-23-2026.md",
            "crop_manifest: floor/bridge_backwalkover_cartwheel"
          ],
          "title": "Bridge to block and arch rock"
        },
        {
          "id": "bridge-backwalkover-cartwheel-progression:variant:1",
          "instructions": [
            "Use lunge to handstand with blocks, or connect lunge, handstand, bridge kickover, and lunge."
          ],
          "sourceRefs": [
            "past: L4_lesson_04-23-2026.md"
          ],
          "title": "Handstand line to bridge kickover"
        },
        {
          "id": "bridge-backwalkover-cartwheel-progression:variant:2",
          "instructions": [
            "Choose a head-spring-over-resi, boulder head-spring, cheese/mailbox front-handspring step-out, or rod-floor front-handspring step-out."
          ],
          "sourceRefs": [
            "past: \u2727 \ud80c\ude86 \ud835\udc0b\ud835\udc1e\ud835\udc2f\ud835\udc1e\ud835\udc25 \ud835\udfd2 \ud835\udc01\ud835\udc28\ud835\udc32\ud835\udc2c \ud835\udc0b\ud835\udc1e\ud835\udc2c\ud835\udc2c\ud835\udc28\ud835\udc27 \ud80c\ude87 \u2727-1.md"
          ],
          "title": "Front-handspring step-out ladder"
        }
      ]
    },
    {
      "coachingCues": [],
      "events": [
        "floor"
      ],
      "goals": [],
      "id": "cartwheel-block-progressions",
      "instructions": [],
      "skills": [
        "cartwheel",
        "handstand",
        "forward roll"
      ],
      "sourceRefs": [
        "crop_manifest: floor/cartwheel_to_belly_handstand"
      ],
      "sourceStatus": "tested",
      "sourceType": "progression",
      "tags": [
        "cartwheel",
        "handstand",
        "block",
        "floor"
      ],
      "title": "Cartwheel Block Progressions",
      "variants": [
        {
          "id": "cartwheel-block-progressions:variant:0",
          "instructions": [
            "Cartwheel to the belly on a block, then step the feet together."
          ],
          "sourceRefs": [
            "past: ADV_lesson_04-21-2026.md",
            "past: ADV_lesson_04-28-2026.md",
            "past: ADV_lesson_05-05-2026.md",
            "crop_manifest: floor/cartwheel_to_belly_handstand"
          ],
          "title": "Cartwheel to belly on block"
        },
        {
          "id": "cartwheel-block-progressions:variant:1",
          "instructions": [
            "Cartwheel to belly on the block, hold 10 seconds, then perform a straight-arm forward roll."
          ],
          "sourceRefs": [
            "past: NGA_lesson_05-01-2026.md"
          ],
          "title": "Cartwheel-belly hold to straight-arm forward roll"
        },
        {
          "id": "cartwheel-block-progressions:variant:2",
          "instructions": [
            "Cartwheel to the belly on a block, hold a handstand, then stomach drop or forward roll to a stick."
          ],
          "sourceRefs": [
            "crop_manifest: floor/cartwheel_to_belly_handstand"
          ],
          "title": "Cartwheel to belly-handstand-roll"
        },
        {
          "id": "cartwheel-block-progressions:variant:3",
          "instructions": [
            "Cartwheel onto a big block, hold a straddle handstand, then step the feet together."
          ],
          "sourceRefs": [
            "past: \u2727 \ud80c\ude86 \ud835\udc00\ud835\udc1d\ud835\udc2f\ud835\udc1a\ud835\udc27\ud835\udc1c\ud835\udc1e\ud835\udc1d \ud835\udc01\ud835\udc28\ud835\udc32\ud835\udc2c \ud835\udc0b\ud835\udc1e\ud835\udc2c\ud835\udc2c\ud835\udc28\ud835\udc27 \ud80c\ude87 \u2727-6.md"
          ],
          "title": "Cartwheel to straddle-handstand"
        },
        {
          "id": "cartwheel-block-progressions:variant:4",
          "instructions": [
            "Use a block or wall station for cartwheel, cartwheel, then step together."
          ],
          "sourceRefs": [
            "past: \u2727 \ud80c\ude86 \ud835\udc0b\ud835\udc1e\ud835\udc2f\ud835\udc1e\ud835\udc25 \ud835\udfd1 \ud835\udc01\ud835\udc28\ud835\udc32\ud835\udc2c \ud835\udc05\ud835\udc2b\ud835\udc22\ud835\udc1d\ud835\udc1a\ud835\udc32\ud80c\ude87 \u2727.md"
          ],
          "title": "Wall cartwheel finish line"
        },
        {
          "id": "cartwheel-block-progressions:variant:5",
          "instructions": [
            "Hold the cartwheel finish while the coach gives a light nudge; build a tight, balanced finish."
          ],
          "sourceRefs": [
            "past: \ud835\udc41\ud835\udc5c\ud835\udc61\ud835\udc52\ud835\udc60.md"
          ],
          "title": "Cartwheel finish balance test"
        }
      ]
    },
    {
      "coachingCues": [],
      "events": [
        "high_bar"
      ],
      "goals": [],
      "id": "drop-kip-kippers-station",
      "instructions": [],
      "skills": [
        "drop kip",
        "kip",
        "undershoot",
        "back hip circle",
        "flyaway"
      ],
      "sourceRefs": [
        "crop_manifest: high_bar/drop_kip_flyaway"
      ],
      "sourceStatus": "tested",
      "sourceType": "station_drill",
      "tags": [
        "drop-kip",
        "kip",
        "high-bar",
        "station"
      ],
      "title": "Drop-Kip and Kippers Station",
      "variants": [
        {
          "id": "drop-kip-kippers-station:variant:0",
          "instructions": [
            "Use a low or raised bar plus mat setup for drop-kip drills and track successful turns."
          ],
          "sourceRefs": [
            "past: NGA_lesson_02-25-2026.md",
            "past: NGA_lesson_03-04-2026.md"
          ],
          "title": "Drop-kip setup"
        },
        {
          "id": "drop-kip-kippers-station:variant:1",
          "instructions": [
            "3s: undershoots, hops, hang half turns, and back hip circles. 4s: flyaways, kips, and kip-cast-horizontal."
          ],
          "sourceRefs": [
            "past: NGA_lesson_02-25-2026.md",
            "past: NGA_lesson_03-04-2026.md"
          ],
          "title": "NGA 3s/4s bar menu"
        }
      ]
    },
    {
      "coachingCues": [],
      "events": [
        "floor"
      ],
      "goals": [],
      "id": "floor-form-and-turn-preparation",
      "instructions": [],
      "skills": [
        "lunge",
        "hurdle",
        "full turn",
        "forward roll",
        "stick"
      ],
      "sourceRefs": [
        "implementation_ideas:53-61",
        "floor_form_challenge:10-17"
      ],
      "sourceStatus": "mixed",
      "sourceType": "form_drill",
      "tags": [
        "form",
        "lunge",
        "turn",
        "hurdle",
        "floor"
      ],
      "title": "Floor Form and Turn Preparation",
      "variants": [
        {
          "id": "floor-form-and-turn-preparation:variant:0",
          "instructions": [
            "Move from stand to a correct lunge position and hold the shape."
          ],
          "sourceRefs": [
            "floor_form_challenge:10"
          ],
          "title": "Stand-to-lunge holds"
        },
        {
          "id": "floor-form-and-turn-preparation:variant:1",
          "instructions": [
            "Perform controlled power hurdles."
          ],
          "sourceRefs": [
            "floor_form_challenge:11"
          ],
          "title": "Power hurdles"
        },
        {
          "id": "floor-form-and-turn-preparation:variant:2",
          "instructions": [
            "Identify the turning side, use the backward-swinging arm to cue direction, then progress from arm swings to half turns to full turns."
          ],